"Refencia";"Descripcion";"Marca";"Pvd";"Pvp";"Unidades caja";"Puntos";"Color"
4298;"Complejo Omega 3 NUTRILITE™";"Nutrilite";35,32 €;0,00 €;"Cantidad: 90 cápsulas";"15,12";
100181;"Café en Grano";"AMWAY";29,46 €;0,00 €;"4x250g";"6,31";
100257;"Café Instantáneo AMWAY™";"AMWAY";29,38 €;0,00 €;"Cantidad: 4 x 100 g";"6,29";
100305;"Biotina C Plus NUTRILITE™";"Nutrilite";19,25 €;0,00 €;"90 comprimidos";"8,24";
101593;"Rhodiola Plus XS™";"XS";30,34 €;36,41 €;"60 COMPRIMIDOS";"12,99";
102736;"Fibra en Polvo NUTRILITE™";"Nutrilite";35,04 €;0,00 €;"30 sobres de 6 g";"15,00";
110178;"Vitamina B Plus NUTRILITE™";"Nutrilite";17,67 €;21,20 €;"60 COMPRIMIDOS";"7,56";
110403;"Aerosol Prewash SA8™";"AMWAY";12,22 €;0,00 €;"400 ml";"4,76";
110483;"Pulverizador de Pistola AMWAY HOME™";"AMWAY";2,55 €;0,00 €;"1 unidad";"0,50";
110487;"Botella de Plástico AMWAY HOME™";"AMWAY";1,80 €;0,00 €;"Cantidad: 1 unidad";"0,35";
111661;"Organizador de Vitaminas NUTRILITE™";"Nutrilite";5,94 €;0,00 €;"Cantidad: 1 unidad";"2,31";
116660;"Batido de Chocolate bodykey™";"Bodykey";43,67 €;0,00 €;"Cantidad: 371g";"18,69";
116661;"Batido de Vainilla bodykey™";"Bodykey";43,67 €;0,00 €;"Cantidad: 329g";"18,69";
116670;"Té de Hierbas bodykey™";"Bodykey";8,33 €;0,00 €;"45g";"3,56";
118766;"Bebida XS™ Power Drink Wild Berry Blast - Sabor Baya Silvestre";"XS";22,61 €;27,13 €;"12 LATAS";"8,80";
119405;"Bebida BEAUTY POWDER DRINK TRUVIVITY BY NUTRILITE™";"Nutrilite";37,13 €;0,00 €;"Suministro para 30 días en sobres de 8,2 g";"15,89";
119407;"Comprimidos BEAUTY SUPPLEMENT TRUVIVITY BY NUTRILITE™";"Nutrilite";67,05 €;0,00 €;"Suministro para 30 días";"28,70";
119792;"Appetite Controller Nutrilite™ (Regulador del apetito)";"Nutrilite";37,53 €;0,00 €;"Cantidad: Cada paquete contiene 30 sobres de 2,5 g";"16,07";
119797;"Vitamina D NUTRILITE™";"Nutrilite";18,40 €;0,00 €;"90 comprimidos";"7,88";
119802;"Bebida XS™ Power Drink Pink Grapefruit Blast – Sabor Pomelo";"XS";22,61 €;27,13 €;"12 LATAS";"8,80";
120854;"Bebida Beauty Drink OxiBeauty™ de TRUVIVITY BY NUTRILITE";"Nutrilite";38,43 €;0,00 €;"Paquetes de sobres de 2,73 g para 30 días";"16,45";
121062;"Sobres de Magnesio XS™";"XS";11,70 €;14,04 €;"30 SOBRES";"5,01";
121602;"Bebida Pre-Entrenamiento XS™ Sabor Lima-Limón";"XS";34,75 €;0,00 €;"15 sobres de 30 g / 450 g";"14,88";
121604;"Bebida Rehidratante XS™ Sabor Lima-Naranja";"XS";21,18 €;0,00 €;"Cantidad: 15 sobres de 25 g / 375 g";"9,08";
121606;"Proteína Hidrolizada de Suero en Polvo XS™ Sabor Cacao-Chocolate";"XS";61,92 €;0,00 €;"700g";"26,51";
121609;"Barritas de Proteínas XS™ Sabor Caramelo-Vainilla";"XS";36,63 €;0,00 €;"12 barritas x 60 g e / 720 g";"15,68";
122109;"Bebida XS™ Power Drink Orange Kumquat Blast - Sabor Naranja";"XS";22,61 €;27,13 €;"12 LATAS";"8,80";
124106;"Pasta Dentífrica Multiacción Glister™";"Glister";6,78 €;0,00 €;"Tamaño completo: tubo de 200 g / 151 ml con tapón abatible";"2,64";
124107;"Pasta Dentífrica Multiacción Glister™ - tamaño viaje";"Glister";2,54 €;0,00 €;"Tamaño de viaje: tubo de 50 g / 37 ml con tapón a rosca";"0,99";
124108;"Enjuague Bucal Multiacción (concentrado) Glister™";"Glister";12,58 €;0,00 €;"Bote PET de 72 ml";"4,90";
124109;"Cepillo Dental Multiacción Glister™ – Suave";"Glister";10,95 €;0,00 €;"4 cepillos por paquete (cada uno de un color diferente). Disponible con cerdas suaves o de dureza media";"4,26";
124110;"Cepillo Dental Multiacción Glister™ – Dureza media";"Glister";10,95 €;0,00 €;"4 cepillos por paquete (cada uno de un color diferente). Disponible con cerdas suaves o de dureza media";"4,26";
124111;"Elixir Bucal Menta en Pulverizador Glister™";"Glister";5,81 €;0,00 €;"Envase de 14 ml con pulverizador";"2,26";
124112;"Hilo Dental Multiacción Glister™";"Glister";10,29 €;0,00 €;"Dos envases de hilo dental de 50 m cada uno";"4,00";
124113;"Enjuague Bucal Multiacción con Aloe Glister™";"Glister";10,41 €;0,00 €;"Envase de 500 ml";"4,05";
124485;"Lejía para Todo Tipo de Prendas SA8™";"AMWAY";15,79 €;0,00 €;"1 Kg";"6,15";
125166;"Cotidiano Nutrilite™";"Nutrilite";17,77 €;0,00 €;"1 envase de 45 comprimidos (1 al día)";"7,61";
125890;"Gel de Ducha g&h GOODNESS & HEALTH™ Nourish";"g&h";9,76 €;0,00 €;"400 ml";"3,80";
125891;"Loción Corporal g&h GOODNESS & HEALTH™ Nourish";"g&h";14,74 €;0,00 €;"400 ml";"5,74";
125892;"Gel de Ducha Exfoliante g&h GOODNESS & HEALTH™ Refresh";"g&h";9,76 €;0,00 €;"400 ml";"3,80";
125893;"Loción Corporal g&h GOODNESS & HEALTH™ Refresh";"g&h";14,74 €;0,00 €;"400 ml";"5,74";
125894;"Jabón para Manos g&h GOODNESS & HEALTH™ Protect";"g&h";7,31 €;0,00 €;"250 ml";"2,84";
125896;"Desodorante Antitranspirante Roll-On g&h GOODNESS & HEALTH™ Protect";"g&h";8,69 €;0,00 €;"100 ml";"3,38";
125897;"Jabón Corporal g&h GOODNESS & HEALTH™ Protect";"g&h";20,46 €;0,00 €;"6 x 150 g";"7,96";
125898;"Desodorante Antitranspirante en Spray g&h GOODNESS & HEALTH™ Protect";"g&h";10,19 €;0,00 €;"200 ml";"3,97";
125899;"Crema para Pies g&h GOODNESS & HEALTH™ Nourish";"g&h";11,07 €;0,00 €;"100 ml";"4,31";
125900;"Bálsamo Labial g&h GOODNESS & HEALTH™ Nourish";"g&h";9,50 €;0,00 €;"4 g / 0,14 OZ";"3,70";
125901;"Protector Solar g&h™ Protect UV FPS 50+ PA++++";"g&h";21,10 €;0,00 €;"Tubo de 100 ml con tapón a rosca y cartón";"8,21";
125902;"Crema de Manos g&h GOODNESS & HEALTH™ Nourish";"g&h";11,98 €;0,00 €;"75 ml / 2.5 fl. Oz";"4,66";
125913;"Jabón Corporal g&h GOODNESS & HEALTH™ Nourish";"g&h";10,76 €;0,00 €;" 250 g";"4,19";
125914;"Gel de Ducha g&h GOODNESS & HEALTH™ Nourish";"g&h";21,15 €;0,00 €;"1000 ml";"8,23";
125915;"Gel de Ducha Exfoliante g&h GOODNESS & HEALTH™ Refresh";"g&h";21,15 €;0,00 €;"1000 ml";"8,23";
126148;"Less Stress, More Yes Nutrilite™";"Nutrilite";23,79 €;0,00 €;"Caja de 30 sobres.";"10,19";
126150;"Be Focused Nutrilite™";"Nutrilite";23,79 €;0,00 €;"60 gominolas por envase";"10,19";
126308;"?Champú y gel de ducha para bebés g&h Baby";"g&h";13,00 €;0,00 €;"400 ml";"5,06";
126309;"Loción para bebés g&h Baby";"g&h";16,98 €;20,38 €;"400 ml";"6,61";
126463;"Champú Anticaspa para Cabello y Cuero Cabelludo Satinique™";"Satinique";13,95 €;0,00 €;"280ml";"5,43";
126466;"Tónico Anticaída para Cuero Cabelludo Satinique™";"Satinique";49,43 €;0,00 €;"120 ml";"19,24";
126624;"Conjunto Cotidiano Nutrilite™";"Nutrilite";67,52 €;0,00 €;"2 envases de 90 comprimidos (1 al día)";"28,90";
126718;"Base de Maquillaje en Sérum FPS 35 PA++ Artistry Future Glow™";"Artistry Skin Nutrition";47,41 €;0,00 €;"30 ml / 35 g / 1,01442 Fl. Oz.";"18,45";"101 shell"
126719;"Base de Maquillaje en Sérum FPS 35 PA++ Artistry Future Glow™";"Artistry Skin Nutrition";47,41 €;0,00 €;"30 ml / 35 g / 1,01442 Fl. Oz.";"18,45";"102 Cashmere"
126720;"Base de Maquillaje en Sérum FPS 35 PA++ Artistry Future Glow™";"Artistry Skin Nutrition";47,41 €;0,00 €;"30 ml / 35 g / 1,01442 Fl. Oz.";"18,45";"103 Ivoroy"
126721;"Base de Maquillaje en Sérum FPS 35 PA++ Artistry Future Glow™";"Artistry Skin Nutrition";47,41 €;0,00 €;"30 ml / 35 g / 1,01442 Fl. Oz.";"18,45";"104 Fawn"
126722;"Base de Maquillaje en Sérum FPS 35 PA++ Artistry Future Glow™";"Artistry Skin Nutrition";47,41 €;0,00 €;"30 ml / 35 g / 1,01442 Fl. Oz.";"18,45";"201 Beige"
126723;"Base de Maquillaje en Sérum FPS 35 PA++ Artistry Future Glow™";"Artistry Skin Nutrition";47,41 €;0,00 €;"30 ml / 35 g / 1,01442 Fl. Oz.";"18,45";"202 Bamboo"
126724;"Base de Maquillaje en Sérum FPS 35 PA++ Artistry Future Glow™";"Artistry Skin Nutrition";47,41 €;0,00 €;"30 ml / 35 g / 1,01442 Fl. Oz.";"18,45";"203 Honey"
126725;"Base de Maquillaje en Sérum FPS 35 PA++ Artistry Future Glow™";"Artistry Skin Nutrition";47,41 €;0,00 €;"30 ml / 35 g / 1,01442 Fl. Oz.";"18,45";"204 Oat"
126726;"Base de Maquillaje en Sérum FPS 35 PA++ Artistry Future Glow™";"Artistry Skin Nutrition";47,41 €;0,00 €;"30 ml / 35 g / 1,01442 Fl. Oz.";"18,45";"301 Biscotti"
126727;"Base de Maquillaje en Sérum FPS 35 PA++ Artistry Future Glow™";"Artistry Skin Nutrition";47,41 €;0,00 €;"30 ml / 35 g / 1,01442 Fl. Oz.";"18,45";"302 Almond"
126728;"Base de Maquillaje en Sérum FPS 35 PA++ Artistry Future Glow™";"Artistry Skin Nutrition";47,41 €;0,00 €;"30 ml / 35 g / 1,01442 Fl. Oz.";"18,45";"303 Chestnut"
126729;"Base de Maquillaje en Sérum FPS 35 PA++ Artistry Future Glow™";"Artistry Skin Nutrition";47,41 €;0,00 €;"30 ml / 35 g / 1,01442 Fl. Oz.";"18,45";"304 Amber"
126730;"Base de Maquillaje en Sérum FPS 35 PA++ Artistry Future Glow™";"Artistry Skin Nutrition";47,41 €;0,00 €;"30 ml / 35 g / 1,01442 Fl. Oz.";"18,45";"305 Cocoa"
126731;"Base de Maquillaje en Sérum FPS 35 PA++ Artistry Future Glow™";"Artistry Skin Nutrition";47,41 €;0,00 €;"30 ml / 35 g / 1,01442 Fl. Oz.";"18,45";"401 Mocha"
126732;"Base de Maquillaje en Sérum FPS 35 PA++ Artistry Future Glow™";"Artistry Skin Nutrition";47,41 €;0,00 €;"30 ml / 35 g / 1,01442 Fl. Oz.";"18,45";"402 Nutmeg"
126733;"Base de Maquillaje en Sérum FPS 35 PA++ Artistry Future Glow™";"Artistry Skin Nutrition";47,41 €;0,00 €;"30 ml / 35 g / 1,01442 Fl. Oz.";"18,45";"403 Java"
126734;"Base de Maquillaje en Sérum FPS 35 PA++ Artistry Future Glow™";"Artistry Skin Nutrition";47,41 €;0,00 €;"30 ml / 35 g / 1,01442 Fl. Oz.";"18,45";"404 Espresso"
126740;"Máscara-Sérum de Pestañas Waterproof Efecto Longitud Artistry Go Vibrant™";"Artistry Skin Nutrition";23,37 €;0,00 €;"8,5 ml / 0.28 fl. oz.";"9,09";
126741;"Lápiz de Ojos Waterproof Artistry Go Vibrant™";"Artistry Skin Nutrition";20,36 €;0,00 €;"0,1 g / 0,003 OZ";"7,93";"NATURAL BROWN"
126744;"Lápiz de Ojos Waterproof Artistry Go Vibrant™";"Artistry Skin Nutrition";20,36 €;0,00 €;"0,1 g / 0,003 OZ";"7,93";"NATRUAL BLACK"
126745;"Lápiz y Gel Fijador de Cejas Waterproof Artistry Go Vibrant™";"Artistry Skin Nutrition";23,96 €;0,00 €;"Lápiz 0,18 g / 0,0063 OZ Gel 2,5 g / 0,088 OZ";"9,32";"TRUE BLACK"
126746;"Lápiz y Gel Fijador de Cejas Waterproof Artistry Go Vibrant™";"Artistry Skin Nutrition";23,96 €;0,00 €;"Lápiz 0,18 g / 0,0063 OZ Gel 2,5 g / 0,088 OZ";"9,32";"TAUPE"
126747;"Lápiz y Gel Fijador de Cejas Waterproof Artistry Go Vibrant™";"Artistry Skin Nutrition";23,96 €;0,00 €;"Lápiz 0,18 g / 0,0063 OZ Gel 2,5 g / 0,088 OZ";"9,32";"DARK BROWN"
126754;"XS™ Amino Advantage+";"XS";45,46 €;54,55 €;"219 GRAMOS";"19,46";
126855;"g&h GOODNESS & HEALTH™ Protect Hand Cleanser";"g&h";14,37 €;0,00 €;"400 ml";"5,59";
127059;"Conjunto Body Cleansing Program";"Nutrilite";136,10 €;0,00 €;"CONJUNTO";"58,27";
127108;"Mascarilla Nocturna Artistry Skin Nutrition™";"Artistry Skin Nutrition";70,46 €;0,00 €;" 80 ml + Masajeador en forma de T";"27,47";
127705;"Cepillo Dental Multiacción Eléctrico Glister™";"Glister";173,65 €;0,00 €;"Cantidad: Cepillo dental: 185,3 x 28,80 x 28,00 mm; caja de limpieza UV: 133,7 x 59,9 x 131,8 mm";"67,58";
127706;"Cabezales de recambio para el Cepillo Dental Multiacción Eléctrico Glister™";"Glister";25,77 €;0,00 €;"3 cabezales de recambio para cepillo";"10,03";
127730;"Barritas XS™ High Protein Energy Bar - Sabor chocolate negro";"XS";37,80 €;0,00 €;"14 barritas x 50 g cada una / 700 g";"16,18";
127731;"Barritas XS™ High Protein Energy Bar – Sabor a coco y recubrimiento de chocolate";"XS";37,80 €;0,00 €;"14 barritas x 50 g cada una / 700 g";"16,18";
271916;"Conjunto promocional Truvivity by Nutrilite™: Beauty Powder Drink y Beauty Supplement";"Nutrilite";93,75 €;0,00 €;"Suministro para 30 días de la bebida BEAUTY POWDER DRINK y el complemento BEAUTY SUPPLEMENT";"40,14";
293033;"Trío Fundamental con DOUBLE X™ NUTRILITE™";"Nutrilite";134,02 €;0,00 €;"1 Omega 3, 1 Proteína Vegetal, 1 DOUBLE X";"57,38";
298812;"XS™ Power Water +";"XS";25,76 €;30,91 €;"12 LATAS";"10,03";
298813;"Bebida XS Power Drink + Sabor Jengibre y Maracuyá";"XS";25,76 €;30,91 €;"12 LATAS";"10,03";
301617;"Mezclador bodykey de NUTRILITE™";"Nutrilite";10,90 €;0,00 €;"Cantidad: 1 ud.";"4,24";
304953;"Conjunto Cuidado del Hogar";"AMWAY";45,51 €;0,00 €;"Botella de Plástico, Estropajos de Acero Inoxidable DISH DROPS™, Limpiador Concentrado ZOOM™, Limpiador de Hornos, Pulverizador de Pistola, L.O.C.,DISH DROPS™";"16,57";"ya no esta"
304955;"Conjunto Actividad Física";"Nutrilite";53,58 €;0,00 €;"1 Barritas de Proteínas Sabor Chocolate, 1 Lecitina E de NUTRILITE";"22,94";
308612;"Can’t Stop Won’t Stop™ Nutrilite™";"Nutrilite";13,48 €;0,00 €;"15 sobres con polvo de disolución rápida por paquete.";"5,77";
308613;"Beauty You Glow Nutrilite™";"Nutrilite";26,72 €;0,00 €;"60 gominolas por envase.";"11,44";
308614;"Sleep Easy Nutrilite™";"Nutrilite";17,00 €;0,00 €;"30 gominolas por envase";"7,28";
314051;"Conjunto Apoyo Inmunitario Estacional Nutrilite™";"Nutrilite";71,48 €;0,00 €;"Conjunto";"32,21";
316099;"Conjunto Empieza la Mañana a Tope Artistry Studio™";"Artistry Skin Nutrition";55,89 €;0,00 €;"Conjunto";"22,9";
316101;"Conjunto Lista para Irte a la Cama en 3 Minutos Artistry Studio™";"Artistry Skin Nutrition";49,94 €;0,00 €;"Conjunto";"20,46";
317514;"Conjunto Body Cleansing Program Refill - sin caja";"Nutrilite";136,10 €;0,00 €;;"58,27";
317878;"Conjunto Familiar Glister™";"Glister";40,12 €;0,00 €;"Conjunto";"16,43";
319385;"Conjunto Rutina de Belleza Saludable Regeneradora Artistry Skin Nutrition™";"Artistry Skin Nutrition";160,35 €;0,00 €;"Conjunto";"65,69";
319392;"Conjunto Rutina de Belleza Saludable Hidratante Artistry Skin Nutrition™";"Artistry Skin Nutrition";117,87 €;0,00 €;"Conjunto";"48,28";
319398;"Conjunto Rutina de Belleza Saludable Reafirmante Artistry Skin Nutrition™";"Artistry Skin Nutrition";166,44 €;0,00 €;"Conjunto";"68,18";
319400;"Conjunto Regenerador Moisturisation Power Artistry Skin Nutrition™";"Artistry Skin Nutrition";161,45 €;0,00 €;"Conjunto";"66,14";
319401;"Conjunto Hidratante Moisturisation Power Artistry Skin Nutrition™";"Artistry Skin Nutrition";92,76 €;0,00 €;"Conjunto";"38";
319402;"Conjunto Reafirmante Moisturisation Power Artistry Skin Nutrition™";"Artistry Skin Nutrition";167,54 €;0,00 €;"Conjunto";"68,63";
319906;;;0,00 €;0,00 €;;;
320868;"Solución de Belleza Holística Hidratante Artistry™";"Artistry Skin Nutrition";178,80 €;0,00 €;"Conjunto";"70,33";
320871;"Solución de Belleza Holística Regeneradora Artistry™";"Artistry Skin Nutrition";181,00 €;0,00 €;"Conjunto";"71,2";
320874;"Solución de Belleza Holística Reafirmante Artistry™";"Artistry Skin Nutrition";193,07 €;0,00 €;"Conjunto";"75,95";
321579;"Batidos XS™ High Protein Energy Shake - Sabor chocolate negro";"XS";52,37 €;0,00 €;"14 sobres x 67,1 g cada uno / 939 g";"22,42";
321906;"Solución Artistry™ Beauty Sleep";"Artistry Skin Nutrition";130,85 €;0,00 €;"Conjunto";"50,92";
321961;"Muestra de Mascarilla Nocturna Artistry Skin Nutrition";"Artistry Skin Nutrition";0,00 €;0,00 €;"muestra";;
322032;"Conjunto Tentempié y Complemento Nutrilite™ Energy Program";"XS";135,63 €;0,00 €;"1 x Barritas XS™ High Protein Energy Bar - Sabor chocolate negro, 1 x Batidos XS™ High Protein Energy Shake - Sabor chocolate negro, 1 x XS™ Amino Advantage+ - Sabor a sandía, 1 mezclador gratis";"58,06";
322033;"Conjunto Complementos Nutrilite™ Energy Program";"Nutrilite";144,72 €;0,00 €;"1 x Complejo Omega 3 Nutrilite™, 1 x Double X™ Nutrilite™, 1 x Nutrilite™ Balance Within™ Probiotics, 1 x organizador de vitaminas";"61,95";
322034;"Conjunto Nutrilite™ Energy Program";"Nutrilite";280,35 €;0,00 €;;"120,01";
323934;"Camiseta XS para hombre talla XL";"XS";0,00 €;0,00 €;;;
